{
  "slug": "the-fault-in-our-stars",
  "featureType": "book",
  "pageTitle": "The Fault in Our Stars: Book vs Movie — Grief as Performance",
  "metaDesc": "John Green's novel traps readers in Hazel's voice—ironic, defensive, terrified. The film softens her into a muse. How the adaptation changes grief into…",
  "h1": "The Fault in Our Stars: When Grief Becomes Watchable",
  "intro": "The Fault in Our Stars works because Hazel Grace Lancaster refuses to perform her dying. She narrates with caustic self-awareness, mocking the very cancer-kid tropes she's trapped inside. The book's emotional engine isn't tragedy—it's the exhausting labor of staying emotionally honest while everyone around you demands inspiration. Hazel's voice is a defense mechanism: if she controls the narrative, she can't be turned into a symbol.\n\nJohn Green's novel succeeds by making the reader complicit in Hazel's resistance. You experience her attraction to Augustus through layers of irony and fear—she wants him, but she's terrified of becoming his tragic muse. The book's structure mirrors this: every romantic gesture is immediately undercut by Hazel's awareness that she's living inside a story she doesn't want to tell. The reader is trapped in her head, forced to feel both the pull of romance and the dread of its inevitable weaponization.\n\nThe 2014 film, directed by Josh Boone, makes a different choice: it lets you watch grief instead of inhabiting it. Shailene Woodley's Hazel is softer, more openly vulnerable, less armed with sarcasm. The movie smooths her defenses into poignancy. Augustus (Ansel Elgort) becomes more straightforwardly romantic, less performatively philosophical. The result is a film that's easier to cry at but harder to believe in—it gives you the catharsis Hazel spent 300 pages refusing to provide.\n\nWhat's at stake is whether grief gets to be ugly. The book insists on Hazel's right to be difficult, resentful, and afraid of being loved. The film offers her as someone easier to mourn. Both versions understand that terminal illness is a narrative trap. Only one refuses to spring it.",
  "quickFacts": {
    "author": "John Green",
    "published": "January 10, 2012",
    "genre": "Young Adult, Contemporary Fiction, Romance",
    "setting": "Indianapolis, Indiana; Amsterdam",
    "adaptations": "2014 film directed by Josh Boone, starring Shailene Woodley and Ansel Elgort",
    "isBasedOnTrueStory": "No, though inspired by Green's friendship with Esther Earl, a young fan who died of thyroid cancer"
  },
  "sections": [
    {
      "id": "the-book",
      "heading": "The Book: Grief as Refusal",
      "body": "John Green's novel is structured as an act of narrative self-defense. Hazel opens by mocking the expectation that her story will be uplifting: she's not a miracle, she's a side effect of an experimental drug. Her voice is caustic, hyper-literate, obsessed with avoiding cliché. She reads obsessively, especially An Imperial Affliction, a novel about a cancer kid that ends mid-sentence—because that's the only honest way a cancer story can end. The book's central tension isn't \"will she survive?\" but \"can she love Augustus without becoming his tragedy?\"\n\nThe romance works because it's built on mutual performance anxiety. Augustus is just as self-conscious as Hazel—he wants to be remembered, to matter, to leave a mark. He stages grand gestures (the pre-funeral, the Amsterdam trip, the swing set) because he's terrified of dying without significance. Hazel sees through this immediately, but she's drawn to him anyway, because his fear mirrors hers. The book's emotional core is their shared recognition that they're both trying to control uncontrollable narratives.\n\nGreen's prose style reinforces this. Hazel's narration is dense with literary references, philosophical asides, and self-interrupting irony. She can't stop analyzing her own feelings, which makes them feel more real—this is how actual teenagers think when they're scared. The book's most devastating moments aren't the deaths, but the small humiliations: Hazel's oxygen tank, her fear of being a grenade, her mother's forced cheerfulness. Green understands that terminal illness is a social performance as much as a medical condition.\n\nThe novel's refusal to offer easy catharsis is its greatest strength. Hazel doesn't learn to \"live fully\" or \"embrace each day.\" She stays angry, scared, and resistant to meaning-making. The book ends not with closure but with her writing her own eulogy for Augustus—taking control of the narrative one last time. It's a story about refusing to be inspiring, which paradoxically makes it more emotionally honest than most cancer narratives."
    },
    {
      "id": "the-adaptation",
      "heading": "The Film: Making Grief Beautiful",
      "body": "Josh Boone's adaptation makes a calculated trade: it sacrifices Hazel's abrasiveness for emotional accessibility. Shailene Woodley plays her as more openly vulnerable, less defended by sarcasm. The film's Hazel cries more, smiles more, and narrates less. Her voice-over is used sparingly, which means we lose the constant internal commentary that made the book feel claustrophobic. We watch her experience grief rather than being trapped inside her resistance to it.\n\nThe movie amplifies the romance and softens the existential dread. Augustus becomes more straightforwardly charming—Ansel Elgort plays him as earnest rather than performative. The \"okay\" exchange, the Anne Frank House kiss, the pre-funeral speech: all are staged as emotional crescendos, designed to maximize tears. The film trusts its images more than its ideas, which makes it visually lush (the Amsterdam sequences are genuinely beautiful) but philosophically thinner. An Imperial Affliction becomes a plot device rather than a thematic mirror.\n\nWhat the film does preserve is the structural honesty of the ending. Augustus's decline is not romanticized—his body fails unglamorously, and Hazel's grief is messy and unresolved. The movie doesn't pretend that love conquers death, which distinguishes it from most YA adaptations. Woodley's performance in the eulogy scene is raw enough to earn the tears it demands. The film understands that the story's power lies in its refusal of false hope.\n\nBut the adaptation loses the book's self-awareness. The movie doesn't interrogate its own sentimentality the way Hazel's narration does. It becomes the kind of \"cancer movie\" the book was written against—beautiful, moving, and easier to consume than to believe. It's a film that trusts you to cry at the right moments, whereas the book made you complicit in resisting those moments. The emotional experience is genuine, but it's no longer uncomfortable."
    },
    {
      "id": "what-changed",
      "heading": "What Changed: Voice, Irony, and the Gaze",
      "body": "The most significant loss is Hazel's narrative voice. The book is told entirely from inside her head, which means every romantic moment is filtered through her fear and self-consciousness. The film, by necessity, externalizes this—we see her face, her reactions, her beauty. The camera makes her watchable in a way the book resists. Woodley is luminous even with an oxygen cannula, which undercuts the book's insistence on the unglamorous reality of illness. The movie can't help but make suffering photogenic.\n\nThe film also softens the book's intellectual density. Hazel and Augustus's conversations in the novel are self-consciously literary—they quote poetry, debate metaphor, perform erudition as a form of flirtation. The movie simplifies this into more naturalistic dialogue, which makes them more relatable but less distinctively nerdy. The \"cigarette metaphor\" scene plays as quirky rather than philosophically desperate. The adaptation assumes viewers won't tolerate the level of pretension the book requires.\n\nPeter Van Houten, the reclusive author, is another casualty. In the book, he's a devastating mirror of Hazel's fears—a man so destroyed by grief that he can't finish his own story. The film (with Willem Dafoe) plays him as more straightforwardly cruel, a villain to be confronted rather than a cautionary tale. The Amsterdam confrontation loses its existential weight and becomes a plot obstacle. The book uses Van Houten to ask whether meaning-making is possible; the film uses him to generate conflict.\n\nWhat remains intact is the structural refusal of false uplift. Both versions end with Hazel reading Augustus's letter, both resist the temptation to show her \"moving on.\" The film earns points for not manufacturing a recovery arc or a lesson learned. But by making Hazel more conventionally sympathetic, it loses the book's central provocation: that dying teenagers don't owe you inspiration, and love doesn't redeem suffering. The movie lets you cry. The book makes you complicit."
    },
    {
      "id": "emotional-engine",
      "heading": "The Emotional Engine: Performing vs. Refusing",